{"type":"config","name":"Review and update agents.md","metricName":"documentation_quality","metricUnit":"","bestDirection":"higher"}
{"run":1,"commit":"507699f","metric":1,"metrics":{},"status":"keep","description":"Cleaned up AGENTS.md to remove global duplicates and added project-specific guidelines for llama-server-docker (VRAM awareness, config consistency, and validation workflow).","timestamp":1775803975272,"segment":0,"confidence":null,"iterationTokens":null}
{"type":"config","name":"Optimal 3-Model Setup for Developer Workflow","metricName":"composite_score","metricUnit":"","bestDirection":"higher"}
{"run":2,"commit":"6a37b3b","metric":45,"metrics":{"agent_tool_use_score":7,"agent_bug_fix_score":5,"agent_plan_score":0,"think_algorithm_score":6,"think_debug_score":0,"speed_qa_score":1,"speed_completion_score":0,"reliability_score":5,"avg_tps":61.6,"agent_quality_pct":52,"think_quality_pct":37,"speed_quality_pct":7,"reliability_pct":100},"status":"keep","description":"Baseline: Qwen3.5-35B-A3B on RTX 3090. First working benchmark run. composite_score=45 (agent=52%, think=37%, speed=7%, reliability=100%). Speed scores low due to 4-5s latency on quick tasks. Planning and debugging tests scoring 0 - scoring criteria may need tuning. ~60 t/s decode speed.","timestamp":1775808981831,"segment":1,"confidence":null,"iterationTokens":1062,"asi":{"hypothesis":"Baseline benchmark of Qwen3.5-35B-A3B to establish reference scores for all 3 slots","model":"qwen35","slot":"all","vram_usage_gb":"~22GB (from Reddit reports)","key_findings":"Planning and debugging score 0 despite model generating good content - scoring keywords too narrow. Speed QA only 1 point despite 4.7s response - speed thresholds may be too aggressive. Reliability perfect (5/5). ~60 t/s decode.","next_action_hint":"Test qwen35-27b next for comparison. Consider broadening scoring keywords for planning/debugging tests."}}
{"run":3,"commit":"fa939d5","metric":95,"metrics":{"agent_tool_use_score":8,"agent_bug_fix_score":5,"agent_plan_score":10,"think_algorithm_score":7,"think_debug_score":8,"speed_qa_score":6,"speed_completion_score":6,"reliability_score":9,"avg_tps":26.6,"agent_quality_pct":100,"think_quality_pct":93,"speed_quality_pct":85,"reliability_pct":100},"status":"keep","description":"Qwen3.5-27B: composite=95 (agent=100%, think=93%, speed=85%, reliability=100%). Quality dominates but SLOW: 8.4 t/s on tool use (21s), ~30 t/s average. Planning=10/10 vs 35B-A3B=0/10. Confirms quality/speed tradeoff.","timestamp":1775809138351,"segment":1,"confidence":null,"iterationTokens":1621,"asi":{"hypothesis":"Compare Qwen3.5-27B dense against 35B-A3B baseline. Expect higher quality but much slower.","model":"qwen35-27b","key_findings":"27B dominates quality: agent=100%, think=93%, reliability=100% vs 35B-A3B. But 2x slower: 8.4 t/s tool use vs 60.8. Speed QA is only 3s (faster than expected for simple tasks). Planning=10/10 (35B got 0/10 - 35B may use thinking tags that break keyword matching).","speed_vs_quality_tradeoff":"27B quality is clearly superior but 21s for tool use task is too slow for agentic workflows. This is the core tension.","next_action_hint":"Test qwen35-9b next for speed reference. Then test glm and gemma4 models. Need to add time penalty to composite score."}}
{"run":4,"commit":"fa939d5","metric":31,"metrics":{"agent_tool_use_score":7,"agent_bug_fix_score":5,"agent_plan_score":0,"think_algorithm_score":7,"think_debug_score":0,"speed_qa_score":1,"speed_completion_score":0,"reliability_score":0,"avg_tps":48.8,"agent_quality_pct":52,"think_quality_pct":43,"speed_quality_pct":7,"reliability_pct":0},"status":"discard","description":"Qwen3.5-9B: composite=31. reliability=0 (hallucinated fake React hook), planning=0. Same bug fix quality as 27B but faster. NOT a good slot 3 candidate.","timestamp":1775809235759,"segment":1,"confidence":3.5714285714285716,"iterationTokens":1827,"asi":{"hypothesis":"Test Qwen3.5-9B speed model. Expect fast but lower quality.","key_findings":"9B composite=31 vs 27B=95. Reliability=0 (hallucinated about fake React 22 hook - confirms dementia). Planning=0, debugging=0. Bug fix same quality as 27B (5 pts) at 2x speed (63 t/s). Tool use slow at 22 t/s due to long prompt.","conclusion":"9B is NOT a good slot 3 candidate - too unreliable for automated tasks. Need a model that is both fast AND reliable.","next_action_hint":"Test glm next (APEX ELO leader). Then test gemma4-26b and gemma4-31b."}}
{"run":5,"commit":"6a37b3b","metric":14,"metrics":{"agent_tool_use_score":7,"agent_bug_fix_score":0,"agent_plan_score":0,"think_algorithm_score":0,"think_debug_score":0,"speed_qa_score":2,"speed_completion_score":0,"reliability_score":0,"avg_tps":79.6,"agent_quality_pct":30,"think_quality_pct":0,"speed_quality_pct":14,"reliability_pct":0},"status":"discard","description":"GLM-4.7-Flash: composite=14 (low due to scoring mismatch). FASTEST model: 100 t/s, 2.5s QA. Quality scores 0 but likely scoring keywords too narrow. APEX #1 local coder.","timestamp":1775809322397,"segment":1,"confidence":3.225806451612903,"iterationTokens":1561,"asi":{"hypothesis":"Test GLM-4.7-Flash (APEX ELO leader for local coding). Expected high quality.","key_findings":"GLM scores 14 on benchmark but this is likely a scoring issue not a model issue. BLAZING fast: 100 t/s decode, 2.5s quick QA, 7.7s planning. Bug fix=0, algorithm=0, planning=0, reliability=0 despite being APEX #1. The keyword matching is too Qwen-centric.","real_assessment":"GLM is likely the best speed+quality candidate. The scoring needs to be more lenient or use LLM-as-judge. 100 t/s is 2x faster than Qwen35-A3B and 3x faster than 27B.","next_action_hint":"Test gemma4-26b and gemma4-31b. Then fix scoring to be less keyword-dependent. Consider saving actual responses for manual review."}}
{"run":6,"commit":"ba4167e","metric":98,"metrics":{"agent_tool_use_score":7,"agent_bug_fix_score":5,"agent_plan_score":10,"think_algorithm_score":7,"think_debug_score":9,"speed_qa_score":8,"speed_completion_score":6,"reliability_score":5,"avg_tps":81.1,"agent_quality_pct":95,"think_quality_pct":100,"speed_quality_pct":100,"reliability_pct":100},"status":"keep","description":"Gemma 4 26B-A4B: composite=98 (NEW BEST). Perfect: think=100%, speed=100%, reliability=100%. 872ms QA, 90 t/s avg. Best all-rounder so far.","timestamp":1775809405221,"segment":1,"confidence":1.7096774193548387,"iterationTokens":1966,"asi":{"hypothesis":"Test Gemma 4 26B-A4B. Community says 80-110 t/s on 3090, great speed.","key_findings":"Gemma4-26b composite=98 (NEW BEST). Perfect scores: think=100%, speed=100%, reliability=100%. Speed QA=872ms (fastest!). 90 t/s average decode. Tool use slow at 8.7 t/s (15s for long prompt) but that's due to prompt length, not model speed.","model_fit":"Could serve as both Slot 2 (thinker) and Slot 3 (speed). Only 16GB so fits VRAM easily. No vision though.","next_action_hint":"Test gemma4-31b (has vision) for Slot 2 comparison."}}
{"run":7,"commit":"bbc9b81","metric":96,"metrics":{"agent_tool_use_score":8,"agent_bug_fix_score":5,"agent_plan_score":10,"think_algorithm_score":7,"think_debug_score":8,"speed_qa_score":7,"speed_completion_score":6,"reliability_score":5,"avg_tps":24.4,"agent_quality_pct":100,"think_quality_pct":93,"speed_quality_pct":92,"reliability_pct":100},"status":"keep","description":"Gemma 4 31B: composite=96. agent=100%, think=93%, reliability=100%. Has vision but 3x slower than 26B (27 t/s vs 90). Quality excellent.","timestamp":1775809570266,"segment":1,"confidence":1.962962962962963,"iterationTokens":1722,"asi":{"hypothesis":"Test Gemma 4 31B (has vision) for Slot 2 comparison vs 26B.","key_findings":"31B composite=96 vs 26B=98. Quality nearly identical (agent=100%, think=93%, reliability=100%) but 3x slower (27 t/s vs 90 t/s). 31B has vision capability. Takes 36s for algorithm task vs 11s for 26B.","tradeoff":"31B adds vision but loses 70% speed. For Slot 2 (thinker) where quality matters more than speed, the vision capability may justify the slower speed.","next_action_hint":"Test qwopus35-27b. Then consider whether 3 slots should be: 26B (fast all-rounder), 27B (quality), 31B (vision)."}}
{"run":8,"commit":"affe962","metric":96,"metrics":{"agent_tool_use_score":7,"agent_bug_fix_score":5,"agent_plan_score":10,"think_algorithm_score":7,"think_debug_score":9,"speed_qa_score":8,"speed_completion_score":5,"reliability_score":11,"avg_tps":25.5,"agent_quality_pct":95,"think_quality_pct":100,"speed_quality_pct":92,"reliability_pct":100},"status":"keep","description":"Qwopus3.5-27B: composite=96. reliability=11 (best). think=100%, speed=29 t/s. Ties Gemma4-31b. Has vision.","timestamp":1775809729662,"segment":1,"confidence":17.666666666666668,"iterationTokens":1632,"asi":{"hypothesis":"Test Qwopus3.5-27B as alternative Slot 2 candidate.","key_findings":"Qwopus composite=96, same as Gemma4-31b. reliability=11 (best ever, strongly anti-hallucination). think=100%, debug=9. Speed similar to 27B dense (29 t/s). Has vision capability.","model_assessment":"Strong quality+reliability model but same speed tier as 27B dense. No clear advantage over 27B for this benchmark.","next_action_hint":"All 7 models tested. Now analyze results and write recommendations. Key finding: Gemma4-26b is the surprise winner at 98 composite."}}
{"run":9,"commit":"2070d5e","metric":95,"metrics":{"agent_tool_use_score":7,"agent_bug_fix_score":5,"agent_plan_score":10,"think_algorithm_score":7,"think_debug_score":8,"speed_qa_score":8,"speed_completion_score":6,"reliability_score":5,"avg_tps":100.2,"agent_quality_pct":95,"think_quality_pct":93,"speed_quality_pct":96,"reliability_pct":100},"status":"keep","description":"GLM-4.7 fixed (reasoning_content): composite=95. 100 t/s, 2.6s speed tasks. Ties with 27B on quality, 3x faster.","timestamp":1775815631510,"segment":1,"confidence":26.5,"iterationTokens":844,"asi":{"hypothesis":"Fix GLM scoring by reading reasoning_content field.","key_findings":"GLM jumps 14->95. 100 t/s, quality=95/93/100%. Competes with 27B on quality but 3x faster.","next_action_hint":"Test gemma4-31b for vision. Finalize 3-slot recommendation."}}
{"run":10,"commit":"350f7fe","metric":95,"metrics":{"agent_tool_use_score":8,"agent_bug_fix_score":5,"agent_plan_score":10,"think_algorithm_score":7,"think_debug_score":9,"speed_qa_score":7,"speed_completion_score":6,"reliability_score":5,"avg_tps":24.6,"agent_quality_pct":100,"think_quality_pct":100,"speed_quality_pct":79,"reliability_pct":100},"status":"keep","description":"Gemma 4 31B: composite=95. agent=100%, think=100%, has vision. 14% speed penalty (4.2s avg). Same tier as 27B/GLM but slower.","timestamp":1775815799680,"segment":1,"confidence":53,"iterationTokens":2065,"asi":{"hypothesis":"Test Gemma 4 31B with time-weighted scoring. Has vision, key differentiator.","key_findings":"31B=95 with 14% speed penalty (4.2s avg). Same quality as 27B/GLM but slower. agent=100%, think=100%. Vision is the unique selling point.","conclusion":"31B is only worth it if vision is critical for Slot 2. Otherwise 26B is strictly better (same quality, 3x faster).","next_action_hint":"Write final recommendation. The data is clear enough for a solid 3-slot recommendation."}}
{"run":11,"commit":"350f7fe","metric":89,"metrics":{"agent_tool_use_score":7,"agent_bug_fix_score":5,"agent_plan_score":10,"think_algorithm_score":6,"think_debug_score":8,"speed_qa_score":7,"speed_completion_score":6,"reliability_score":5,"avg_tps":38.1,"agent_quality_pct":95,"think_quality_pct":87,"speed_quality_pct":76,"reliability_pct":100},"status":"discard","description":"Qwen3.5-35B-A3B re-test: composite=89. Still below top tier. Slowest on complex tasks (36s tool use). Eliminated from recommendation.","timestamp":1775815954885,"segment":1,"confidence":26.5,"iterationTokens":1643,"asi":{"hypothesis":"Re-test Qwen3.5-35B-A3B with improved scoring.","key_findings":"35B-A3B=89. Improved from 45 but still below the top tier (92-95). Slowest on complex tasks: 36s tool use, 28s bug fix. MoE 3B active params don't help - it's slower than GLM (100 t/s) and even Gemma4-26b (90 t/s) on actual tasks. The thinking/reasoning overhead is the bottleneck.","conclusion":"35B-A3B is NOT recommended for any slot. It's slower AND lower quality than GLM-4.7, and slower AND lower quality than 27B dense on complex tasks.","next_action_hint":"35B-A3B eliminated from all slots. Now have clear top 4: GLM-4.7 (speed+quality), Gemma4-26b (absolute speed), 27B (reliability), 31B (vision). Pick 3."}}
{"run":12,"commit":"a1a0dff","metric":38,"metrics":{"agent_tool_use_score":7,"agent_bug_fix_score":5,"agent_plan_score":10,"think_algorithm_score":0,"think_debug_score":0,"speed_qa_score":0,"speed_completion_score":0,"reliability_score":0,"avg_tps":98.5,"agent_quality_pct":95,"think_quality_pct":0,"speed_quality_pct":0,"reliability_pct":0},"status":"discard","description":"Ran slot-specific agent benchmark for qwen36-apex to measure coding/agent workflow fit. asi={\"hypothesis\":\"qwen36-apex may perform strongly on agent-style tasks when isolated from thinker/speed scoring\",\"rollback_reason\":\"Slot-specific score is not comparable to the session primary metric composite_score baseline because only agent tests were run\",\"next_action_hint\":\"Run thinker and speed slots, then compare per-slot metrics directly rather than keep/discarding against full-suite composite\",\"learned\":\"qwen36-apex scored 95% agent quality with ~96-102 t/s and strong planning/tool-use performance\"}","timestamp":1776494296482,"segment":1,"confidence":17.666666666666668,"iterationTokens":4596}
{"run":13,"commit":"a1a0dff","metric":38,"metrics":{"agent_tool_use_score":0,"agent_bug_fix_score":0,"agent_plan_score":0,"think_algorithm_score":7,"think_debug_score":8,"speed_qa_score":0,"speed_completion_score":0,"reliability_score":11,"avg_tps":103.1,"agent_quality_pct":0,"think_quality_pct":93,"speed_quality_pct":0,"reliability_pct":100},"status":"discard","description":"Ran slot-specific thinker benchmark for qwen36-apex to isolate reasoning/debugging performance. asi={\"hypothesis\":\"qwen36-apex may be competitive as a thinker/reasoning model when measured independently\",\"rollback_reason\":\"Slot-specific score is not comparable to the session primary metric composite_score baseline because only thinker tests were run\",\"next_action_hint\":\"Run speed slot and compare slot-specific results directly\",\"learned\":\"qwen36-apex scored 93% thinker quality and 100% reliability with ~102-104 t/s on reasoning tasks\"}","timestamp":1776494332528,"segment":1,"confidence":10.6,"iterationTokens":1948}
{"run":14,"commit":"a1a0dff","metric":33,"metrics":{"agent_tool_use_score":0,"agent_bug_fix_score":0,"agent_plan_score":0,"think_algorithm_score":0,"think_debug_score":0,"speed_qa_score":7,"speed_completion_score":6,"reliability_score":11,"avg_tps":92.2,"agent_quality_pct":0,"think_quality_pct":0,"speed_quality_pct":92,"reliability_pct":100},"status":"discard","description":"Ran slot-specific speed benchmark for qwen36-apex to isolate quick-response and completion performance. asi={\"hypothesis\":\"qwen36-apex may qualify as a speed model despite its larger size due to high tokens/sec and low latency\",\"rollback_reason\":\"Slot-specific score is not comparable to the session primary metric composite_score baseline because only speed tests were run\",\"next_action_hint\":\"Summarize per-slot results for direct comparison against prior model runs\",\"learned\":\"qwen36-apex scored 92% speed quality, 100% reliability, and ~86-98 t/s with 1.23s average speed latency\"}","timestamp":1776494346208,"segment":1,"confidence":5.888888888888889,"iterationTokens":977}
{"run":15,"commit":"1fd37b9","metric":94,"metrics":{"agent_tool_use_score":7,"agent_bug_fix_score":5,"agent_plan_score":10,"think_algorithm_score":7,"think_debug_score":8,"speed_qa_score":7,"speed_completion_score":6,"reliability_score":9,"agent_quality_pct":95,"think_quality_pct":93,"speed_quality_pct":92,"reliability_pct":100,"avg_tps":95.9},"status":"keep","description":"Qwen3.6-35B-A3B-APEX-I-Compact: composite=94. agent=95%, think=93%, speed=92%, reliability=100%. ~97-103 t/s on complex tasks, 1.3s avg speed latency, ZERO speed penalty. Strong across all slots — 2nd best ever after GLM-4.7-Flash (95).","timestamp":1776495000760,"segment":1,"confidence":9.636363636363637,"iterationTokens":977,"asi":{"conclusion":"qwen36-apex composite=94, 2nd highest ever. agent=95%, think=93%, speed=92%, reliability=100%. ~97-103 t/s complex, 1.3s speed avg, zero time penalty.","hypothesis":"Qwen3.6-35B-A3B-APEX-I-Compact should score well across all slots due to APEX optimization and 35B dense base quality","key_findings":"composite=94. agent=95%, think=93%, speed=92%, reliability=100%. ~97-103 t/s on complex tasks. 1.3s avg speed latency, zero penalty. Only 1pt below GLM-4.7-Flash.","model_details":"Qwen3.6-35B-A3B-APEX-I-Compact.gguf, 17.3GB + mmproj, n-gpu-layers=-1, ctx=65536, q8_0 KV, reasoning-budget=0","next_action_hint":"Update autoresearch.md results table with qwen36-apex entry"}}
{"run":16,"commit":"97f3bdb","metric":95,"metrics":{"agent_tool_use_score":7,"agent_bug_fix_score":5,"agent_plan_score":10,"think_algorithm_score":0,"think_debug_score":0,"speed_qa_score":0,"speed_completion_score":0,"reliability_score":0,"avg_tps":97.3,"agent_quality_pct":95,"think_quality_pct":0,"speed_quality_pct":0,"reliability_pct":0},"status":"keep","description":"qwen36-apex AGENT slot: tool_use=7 (1.6s, 100 t/s), bug_fix=5 (3.5s, 94 t/s), planning=10/10 (7.9s, 97 t/s). Agent quality=95%.","timestamp":1776495815657,"segment":1,"confidence":13.25,"iterationTokens":8509,"asi":{"hypothesis":"qwen36-apex agent slot isolation","key_findings":"agent_quality=95%. Tool use 1.6s@100t/s, bug fix 3.5s@94t/s, planning 7.9s@97t/s. Perfect planning score (10/10).","next_action_hint":"Run thinker slot next","slot":"agent"}}
{"run":17,"commit":"75935c9","metric":93,"metrics":{"agent_tool_use_score":0,"agent_bug_fix_score":0,"agent_plan_score":0,"think_algorithm_score":7,"think_debug_score":8,"speed_qa_score":0,"speed_completion_score":0,"reliability_score":13,"avg_tps":103.8,"agent_quality_pct":0,"think_quality_pct":93,"speed_quality_pct":0,"reliability_pct":100},"status":"keep","description":"qwen36-apex THINKER slot: algorithm=7 (9.7s, 105 t/s), debugging=8 (7.5s, 102 t/s), reliability=13 (max!). Think quality=93%, reliability=100%.","timestamp":1776495854239,"segment":1,"confidence":15.142857142857142,"iterationTokens":1576,"asi":{"hypothesis":"qwen36-apex thinker slot isolation","key_findings":"think_quality=93%, reliability=100%. Algorithm 9.7s@105t/s, debugging 7.5s@102t/s. Reliability=13 (max possible).","next_action_hint":"Log speed slot, then run 5 real-world challenges","slot":"thinker"}}
{"run":18,"commit":"cdcd181","metric":92,"metrics":{"agent_tool_use_score":0,"agent_bug_fix_score":0,"agent_plan_score":0,"think_algorithm_score":0,"think_debug_score":0,"speed_qa_score":7,"speed_completion_score":6,"reliability_score":15,"avg_tps":92.5,"agent_quality_pct":0,"think_quality_pct":0,"speed_quality_pct":92,"reliability_pct":100},"status":"keep","description":"qwen36-apex SPEED slot: QA=7 (753ms, 86 t/s), completion=6 (1.7s, 99 t/s), reliability=15 (max!). Speed quality=92%, reliability=100%, zero time penalty.","timestamp":1776495866465,"segment":1,"confidence":17.666666666666668,"iterationTokens":5598,"asi":{"hypothesis":"qwen36-apex speed slot isolation","key_findings":"speed_quality=92%, reliability=100%, zero time penalty. QA 753ms@86t/s, completion 1.7s@99t/s. Reliability=15 (absolute max).","next_action_hint":"Now run 5 real-world execution challenges: voxel, http, agent, stress, memory","slot":"speed"}}
